{
  "world": {
    "id": "security_adventure",
    "title": "SecurityAdventure",
    "language": "en",
    "startScene": "lobby",
    "player": "justin",
    "riskStart": 0
  },

  "scenes": {

    "lobby": {
      "background": "assets/sa/lobby.png",
      "music": "track_lobby",
      "horizon": { "x": 480, "y": 200 },
      "walkbox": [
        { "x": 80,  "y": 510 },
        { "x": 880, "y": 510 },
        { "x": 760, "y": 320 },
        { "x": 200, "y": 320 }
      ],
      "actors": ["smarty", "wanda"],
      "transporters": [
        {
          "id": "to_server_room",
          "label": "Walk to Server Room",
          "target": "server_room",
          "entryX": 120,
          "entryY": 450,
          "x": 820, "y": 200,
          "w": 120, "h": 310,
          "walkToX": 860, "walkToY": 450
        },
        {
          "id": "to_parking_lot",
          "label": "Walk to Parking Lot",
          "target": "parking_lot",
          "entryX": 800,
          "entryY": 450,
          "x": 0, "y": 200,
          "w": 80, "h": 310,
          "walkToX": 60, "walkToY": 450
        },
        {
          "id": "to_cafeteria",
          "label": "Walk to Cafeteria",
          "target": "cafeteria",
          "entryX": 480,
          "entryY": 440,
          "x": 360, "y": 540,
          "w": 240, "h": 60,
          "walkToX": 480, "walkToY": 510
        },
        {
          "id": "to_workstation",
          "label": "Walk to Workstation",
          "target": "workstation",
          "entryX": 480,
          "entryY": 450,
          "x": 600, "y": 100,
          "w": 200, "h": 100,
          "walkToX": 680, "walkToY": 330
        },
        {
          "id": "to_boardroom",
          "label": "Walk to Boardroom",
          "target": "boardroom",
          "entryX": 480,
          "entryY": 450,
          "x": 200, "y": 100,
          "w": 200, "h": 100,
          "walkToX": 300, "walkToY": 330
        }
      ],
      "hotspots": [
        {
          "id": "notice_board",
          "name": "Notice Board",
          "x": 80, "y": 160,
          "w": 200, "h": 220,
          "walkToX": 175, "walkToY": 440,
          "examine": "A notice board covered in printouts. One catches your eye — a password reminder from 'IT Support'.",
          "script": "phishing_email"
        },
        {
          "id": "reception_desk",
          "name": "Reception Desk",
          "x": 310, "y": 340,
          "w": 340, "h": 120,
          "walkToX": 480, "walkToY": 460,
          "examine": "The reception desk. A sign reads: 'All visitors must sign in. Tailgating is a security violation.'"
        },
        {
          "id": "security_poster",
          "name": "Security Poster",
          "x": 590, "y": 140,
          "w": 160, "h": 200,
          "walkToX": 670, "walkToY": 390,
          "examine": "A Government of Canada security awareness poster. It says: 'Think Before You Click. Report Suspicious Emails.'"
        },
        {
          "id": "wanda_briefcase",
          "name": "Suspicious Briefcase",
          "x": 700, "y": 400,
          "w": 90, "h": 80,
          "walkToX": 720, "walkToY": 470,
          "examine": "A briefcase with a USB drive sticking out of the pocket. It looks like it was left here deliberately.",
          "script": "briefcase_examine"
        }
      ]
    },

    "server_room": {
      "background": "assets/sa/server_room.png",
      "horizon": { "x": 480, "y": 180 },
      "walkbox": [
        { "x": 60,  "y": 510 },
        { "x": 900, "y": 510 },
        { "x": 800, "y": 310 },
        { "x": 160, "y": 310 }
      ],
      "actors": [],
      "transporters": [
        {
          "id": "to_lobby",
          "label": "Walk to Lobby",
          "target": "lobby",
          "entryX": 840,
          "entryY": 440,
          "x": 0, "y": 280,
          "w": 80, "h": 240,
          "walkToX": 60, "walkToY": 450
        }
      ],
      "hotspots": [
        {
          "id": "usb_drive",
          "name": "Unknown USB Drive",
          "x": 380, "y": 350,
          "w": 80, "h": 60,
          "walkToX": 420, "walkToY": 460,
          "examine": "A USB drive sitting on top of a server. Someone may have left it here, or planted it.",
          "script": "usb_drop"
        },
        {
          "id": "server_rack",
          "name": "Server Rack",
          "x": 160, "y": 130,
          "w": 260, "h": 330,
          "walkToX": 265, "walkToY": 440,
          "examine": "A rack of servers humming quietly. The blinking lights make it look alive. No external devices should be connected to these."
        },
        {
          "id": "access_log_terminal",
          "name": "Access Log Terminal",
          "x": 680, "y": 260,
          "w": 190, "h": 200,
          "walkToX": 760, "walkToY": 450,
          "examine": "A terminal showing the access log. You notice Wanda's badge was scanned in twice this morning — but she didn't sign the physical visitor log.",
          "script": "access_log_review"
        }
      ]
    },

    "parking_lot": {
      "background": "assets/sa/parking_lot.png",
      "horizon": { "x": 480, "y": 220 },
      "walkbox": [
        { "x": 60,  "y": 510 },
        { "x": 900, "y": 510 },
        { "x": 820, "y": 300 },
        { "x": 140, "y": 300 }
      ],
      "actors": ["wanda"],
      "transporters": [
        {
          "id": "to_lobby_from_parking",
          "label": "Walk to Lobby",
          "target": "lobby",
          "entryX": 80,
          "entryY": 450,
          "x": 800, "y": 220,
          "w": 160, "h": 290,
          "walkToX": 860, "walkToY": 460
        }
      ],
      "hotspots": [
        {
          "id": "secure_door",
          "name": "Secure Entry Door",
          "x": 650, "y": 180,
          "w": 140, "h": 280,
          "walkToX": 700, "walkToY": 460,
          "examine": "The secure entry to the building. A badge reader is mounted beside it. Wanda is holding the door open and waving you through.",
          "script": "tailgating_encounter"
        },
        {
          "id": "badge_reader",
          "name": "Badge Reader",
          "x": 600, "y": 300,
          "w": 60, "h": 80,
          "walkToX": 620, "walkToY": 460,
          "examine": "The electronic badge reader. All employees must tap their own badge to enter — no exceptions. Piggybacking behind another person is a policy violation."
        },
        {
          "id": "tailgate_sign",
          "name": "Security Sign",
          "x": 100, "y": 160,
          "w": 180, "h": 130,
          "walkToX": 180, "walkToY": 420,
          "examine": "A posted sign reads: 'ONE PERSON PER BADGE SWIPE. Tailgating is a security violation and may result in disciplinary action. Report incidents to 1-800-GOV-SAFE.'"
        }
      ]
    },

    "cafeteria": {
      "background": "assets/sa/cafeteria.png",
      "horizon": { "x": 480, "y": 210 },
      "walkbox": [
        { "x": 60,  "y": 510 },
        { "x": 900, "y": 510 },
        { "x": 820, "y": 300 },
        { "x": 140, "y": 300 }
      ],
      "actors": ["wanda"],
      "transporters": [
        {
          "id": "to_lobby_from_cafe",
          "label": "Walk to Lobby",
          "target": "lobby",
          "entryX": 480,
          "entryY": 500,
          "x": 0, "y": 260,
          "w": 80, "h": 260,
          "walkToX": 60, "walkToY": 460
        }
      ],
      "hotspots": [
        {
          "id": "wandas_table",
          "name": "Wanda's Laptop",
          "x": 500, "y": 300,
          "w": 180, "h": 120,
          "walkToX": 540, "walkToY": 460,
          "examine": "Wanda's laptop is open, facing the cafeteria. A spreadsheet is clearly visible showing employee names and salary bands. Anyone walking by can read it.",
          "script": "shoulder_surf"
        },
        {
          "id": "lunch_counter",
          "name": "Lunch Counter",
          "x": 80, "y": 200,
          "w": 300, "h": 160,
          "walkToX": 200, "walkToY": 420,
          "examine": "The lunch counter. Today's special: vegetable soup and a bun. Nothing suspicious here — though you can see Wanda's screen from here too."
        },
        {
          "id": "cafe_security_poster",
          "name": "Privacy Reminder",
          "x": 820, "y": 160,
          "w": 130, "h": 180,
          "walkToX": 840, "walkToY": 440,
          "examine": "A Treasury Board of Canada poster: 'Protect Sensitive Information. In public spaces, use a privacy screen and be aware of who can see your work.'"
        }
      ]
    },

    "workstation": {
      "background": "assets/sa/workstation.png",
      "horizon": { "x": 480, "y": 200 },
      "walkbox": [
        { "x": 60,  "y": 510 },
        { "x": 900, "y": 510 },
        { "x": 820, "y": 300 },
        { "x": 140, "y": 300 }
      ],
      "actors": [],
      "transporters": [
        {
          "id": "to_lobby_from_desk",
          "label": "Walk to Lobby",
          "target": "lobby",
          "entryX": 480,
          "entryY": 500,
          "x": 0, "y": 260,
          "w": 80, "h": 260,
          "walkToX": 60, "walkToY": 460
        }
      ],
      "hotspots": [
        {
          "id": "unlocked_screen",
          "name": "Unlocked Workstation",
          "x": 280, "y": 160,
          "w": 240, "h": 200,
          "walkToX": 380, "walkToY": 440,
          "examine": "Justin's government workstation. The screen is unlocked and showing an open email with sensitive departmental figures. Anyone walking by can read it.",
          "script": "screen_lock_check"
        },
        {
          "id": "sticky_note",
          "name": "Sticky Note",
          "x": 540, "y": 280,
          "w": 100, "h": 80,
          "walkToX": 560, "walkToY": 440,
          "examine": "A yellow sticky note stuck to the monitor bezel. It reads: 'Password: Canada2024!' in blue pen. Anyone at the desk can read it.",
          "script": "password_hygiene"
        },
        {
          "id": "document_pile",